Source,Articles,Year,Translated Articles
https://rtnc.cd/affaire-m23-le-president-tshisekedi-charge-le-rwanda-du-haut-de-la-tribune-de-lonu-a-new-york/,"Le président de la République, Félix-Antoine Tshisekedi a fustigé, du haut de la tribune de l’ONU à New York, l’agression rwandaise sous couvert de M23, dont la République démocratique du Congo est victime, rapporte une dépêche de la presse présidentielle parvenue ce mercredi 21 septembre 2022 à RTNC.CD. Le Chef de l’Etat congolais a présenté, au cours de la 77 e session ordinaire de l’assemblée générale de l’ONU mardi 20 septembre, les éléments probants attestant l’agression rwandaise dans la partie Est de son pays, en dépit de la présence des forces de la Monusco. « Le mal ronge toujours le pays malgré la présence militaire massive de la Monusco et son soutien diplomatique pendant 23 ans. Malgré ma bonne volonté et la main tendue du Peuple congolais pour la paix, certains de nos voisins n’ont trouvé mieux que nous remercier par l’agression et le soutien à des groupes armés terroristes qui écument l’Est de la RDC » clamait le président de la République qui a cité le Rwanda comme pays agresseur par l’entremise du mouvement de 23 mars, ( M23), auquel il apporte un soutien tant en matériels de guerre qu’en hommes de troupes. Et d’ajouter : « Nous, Peuple congolais, sommes décidés, cette fois-ci, de mettre fin à l’insécurité à l’Est de notre pays, quoi qu’il en coûte. L’heure a sonné de casser à jamais le cycle infernal de violences à l’Est de la RDC pour stabiliser la Région des Grands Lacs. (…) » S’agissant du prétexte dont s’est toujours servi le Rwanda pour justifier ses incursions armées en RDC, à savoir, la présence des FDLR sur le sol congolais, le président Félix Tshisekedi l’a balayé d’un revers de main, le considérant comme un, » alibi qui ne corrobore aucun fait avéré sur le terrain »; d’autant plus que les FDLR ont été réduites à néant par les FARDC, en étroite collaboration avec l’Armée rwandaise dans le cadre des opérations conjointes menées au cours de ces dernières années. Dans la foulée, le président tshisekedi a fait part de la disponibilité de son pays à mener toute action répressive contre tout groupe armé qui tenterait de troubler la paix et la sécurité dans un pays voisin et dans la région des Grands Lacs. « L’ONU doit rendre effectif le retrait immédiat du M23 des localités occupées, et veiller à la cessation sans condition du soutien de l’armée rwandaise à ce groupe terroriste, selon l’esprit et la lettre de la feuille de route de Luanda approuvée par la RDC et le Rwanda, ainsi que d’autres accords y relatifs ; l’ONU devrait aussi s’employer à lever tout obstacle à la restructuration par la RDC de ses Forces Armées et à la montée en puissance pour mieux remplir ses missions régaliennes, la levée pure et simple de toutes les mesures restrictives de l’acquisition des équipements militaires, quelle qu’en soit la forme édictée par le Conseil de sécurité de l’ONU ». Du point de vue régional, Félix Tshisekedi a appelé à la levée immédiate des sanctions contre la République du Zimbabwe et son Peuple. Il a également évoqué les atouts dont dispose la RDC, un des principaux producteurs des minerais stratégiques essentiels à la transition énergétique, à titre de contribution à la mobilisation des alternatives crédibles à la double crise énergétique et écologique. Il sied de signaler que c’est pour la deuxième fois que le président congolais hausse le ton du haut de la tribune de l’ONU, pour les sanctions imposées au Zimbabwe depuis plus de 20 ans par les USA et l’Union européenne.Advertisement. Scroll to continue reading. (Ci-dessous le discours en entier) 77è Assemblée Générale des Nations Unies il",2022,"The President of the Republic, Félix-Antoine Tshisekedi has castigated, from the top of the UN gallery in New York, the Rwandan assault under cover of M23, of which the Democratic Republic of Congo is a victim, reports a dispatch from the presspresidential election this Wednesday, September 21, 2022 in RTNC.CD.The Congolese head of state presented, during the 77 th ordinary session of the UN General Assembly on Tuesday, September 20, the convincing elements attesting the Rwandan aggression in the eastern part of his country, despiteThe presence of the Monusco forces.“Evil still consumes the country despite the massive military presence of Monusco and its diplomatic support for 23 years.Despite my good will and the outstretched hand of the Congolese people for peace, some of our neighbors found better than thanking us through the assault and support for terrorist armed groups that scour the east of the DRC ”proclaimed thePresident of the Republic which cited Rwanda as a country attacker through the movement of March 23, (M23), to which he provides support both in war materials and in troop men.And to add: ""We, Congolese people, are decided, this time, to end insecurity in the east of our country, whatever it costs.The time has ranged to break the infernal cycle of violence forever in the east of the DRC to stabilize the Great Lakes region.(…) ”Regarding the pretext that Rwanda has always used to justify its armed incursions in the DRC, namely, the presence of FDLR on Congolese soil, President Félix Tshisekedi swept it from a reverse ofhand, considering it as one, ""alibi which does not corroborate any proven fact on the ground"";Especially since the FDLRs have been reduced to the FARDC, in close collaboration with the Rwandan army as part of the joint operations carried out in recent years.In the process, President Tshisekedi expressed the availability of his country to carry out any repressive action against any armed group which would try to disturb peace and security in a neighboring country and in the region of the Great Lakes.""The UN must make effective the immediate withdrawal of the M23 of the occupied localities, and ensure the shortfall of the support of the Rwandan army to this terrorist group, according to the spirit and the letter of the Luanda roadmap approvedby the DRC and Rwanda, as well as other relative agreements;The UN should also work to remove any obstacle to the DRC restructuring of its armed forces and to the rise in power to better fulfill its sovereign missions, the pure and simple lifting of all restrictive measures of the acquisition ofmilitary equipment, whatever the form decreed by the UN Security Council ”.From a regional point of view, Félix Tshisekedi called for the immediate lifting of sanctions against the Republic of Zimbabwe and its people.He also mentioned the assets available to the DRC, one of the main producers of strategic minerals essential to the energy transition, as a contribution to the mobilization of credible alternatives to the double energy and ecological crisis.It is said to point out that it is for the second time that the Congolese president has increased the tone from the top of the UN gallery, for the sanctions imposed in Zimbabwe for more than 20 years by the USA and the European Union. Advertisement.Scroll to continue reading.(Below the entire speech) 77th General Assembly of the United Nations"
https://rtnc.cd/rdc-la-derniere-attaque-de-la-coalition-armee-rwandaise-m23-a-rangira-debattue-au-conseil-des-ministres/,"Intervenant le vendredi 26 août 2022 au conseil des ministres par visioconférence, le vice-ministre de l’Intérieur, sécurité́, décentralisation et affaires coutumières a, au nom de son titulaire, informé le gouvernement de l’état du territoire qui reste dominé par la poursuite des Operations militaires contre les groupes terroristes et autres forces négatives, notamment en Ituri et au Nord-Kivu. Il a également signalé au conseil quelques cas de catastrophe naturelle intervenue dans le Sud-Ubangi où 300 habitations ont été́ inondées à la suite d’une pluie diluvienne du 22 août 2022 à Zongo et dans le Haut-Katanga où 17 creuseurs artisanaux ont été engloutis à la suite de l’éboulement survenu dans une carrière minière appelée « 03 à Midingi » dans le territoire de Kambove, le 22 août 2022. Concernant la situation sécuritaire, le vice-ministre de la défense nationale et anciens combattants, représentant le ministre en mission, a rappelé que la partie Est du pays est en proie à l’activisme des forces négatives et des groupes armés. Il est revenu sur le conflit qui oppose Yaka et Teke dans la province de Maï-Ndombe, où 18 personnes ont été tuées dont 09 du côté Yaka de Masia y compris le chef de terre et sa femme ; 175 maisons incendiées et 01 arme AK47 d’un élément de la Police nationale Congolaise emportée par les assaillants Teke. Dans la province du Kongo-central : le 20 août 2022 a eu lieu le meurtre par la population, d’un élément du Bataillon quartier général Baki, détaché à la Société́ Perenco suite aux tirs de sommation exécutés par ce dernier pour sauver la vie à un motard. Dans la province du Nord-Kivu : Il a été signalé, à la même date en territoire de Beni, une attaque des combattants Maï-Maï sous commandement de sieur Biadjuma contre une position du 312ème Bataillon réaction rapide. Un assaillant a été capturé. «Par ailleurs, les positions des Forces Armées de la République démocratique du Congo ont été pilonnées par la coalition RDF-Terroristes M23 à Rangira dans le territoire de Rutshuru, le 20 aout 2022, à partir de la colline Shwema.», rapporte le porte parole du gouvernement Patrick Muyaya Katembwe qui a fait le compte rendu sur les antennes de la RTNC. S’agissant du dernier point sur l’examen et adoption de textes, le vice-ministre de la Justice et garde des sceaux a soumis au Conseil le Projet de Loi autorisant la prorogation de l’état de siège dans les provinces de l’Ituri et du Nord-Kivu pour une période de 15 jours prenant cours le 30 août 2022. Il a fait savoir que cette prorogation permettra aux Forces de défense et de sécurité́ de consolider les acquis des Operations antérieures et de poursuivre : d’une part, les actions en vue de mettre fin à l’agression perpétrée par le Rwanda à travers le groupe terroriste M23 et d’autre part, les autres groupes armes tant locaux qu’étrangers opérant dans le grand nord de la province du Nord-Kivu et dans la province de l’Ituri. La rédaction",2022,"Intervening on Friday August 26, 2022 on the Council of Ministers by videoconference, the Deputy Minister of the Interior, Security, Decentralization and Customary Affairs has, on behalf of its holder, informed the government of the state of the territory which remains dominated by theContinuation of military operations against terrorist groups and other negative forces, notably in Ituri and North Kivu.He also pointed out to the council some cases of natural disaster which occurred in South-Ubangi where 300 dwellings were flooded following a torrential rain on August 22, 2022 in Zongo and in Haut-Katanga where 17 artisanal Creusers were swallowed upFollowing the landslide occurring in a mining career called ""03 in Mdingi"" in the territory of Kambove, August 22, 2022. Regarding the security situation, the Deputy Minister of National Defense and Veterans, representing the Minister inMission, recalled that the eastern part of the country is plagued by activism of negative forces and armed groups.He returned to the conflict between Yaka and Teke in the province of Maï-Ndombe, where 18 people were killed including 09 on the Yaka side of Masia including the head of land and his wife;175 burned houses and 01 AK47 weapon of an element of the Congolese national police swept away by the teke attackers.In the province of Kongo-Central: August 20, 2022 took place the murder by the population, of an element of the Baki Headquarters Battalion, detached from the Penenco Society following the summation shots executed by the latter to save life to lifeA biker.In the province of North Kivu: on the same date in Beni territory, an attack by the Mayi-Mayi fighters under command of Sieur Biadju, a position of the 312nd battalion rapid reaction.An assailant was captured.""In addition, the positions of the armed forces of the Democratic Republic of Congo were pounded by the RDF-Terrorist M23 coalition in Rangira in the territory of Rutshuru, August 2022, from the Shwema hill."", Reports the doorWord of the government Patrick Muyaya Katembwe which reported on the antennas of RTNC.Regarding the last point on the examination and adoption of texts, the Deputy Minister of Justice and Keeper of the Seals submitted to the Board the bill authorizing the extension of the state of siege in the provinces of Ituriand from North Kivu for a period of 15 days taking lessons on August 30, 2022. He said that this extension will allow the defense and security forces to consolidate the achievements of previous operations and to continue: on the one hand, theActions in order to put an end to the aggression perpetrated by Rwanda through the M23 terrorist group and on the other hand, the other local weapons groups and foreigners operating in the Far North of the Province of North Kivu and in theITUI province.Writing"
https://rtnc.cd/kigali-jai-discute-avec-paul-kagame-de-rapports-credibles-selon-lesquels-le-rwanda-continue-a-soutenir-le-groupe-rebelle-m23-en-rdc-antony-blinken/,"Le rapport des experts de l’ONU sur le soutient du Rwanda au M23 continue à préoccuper les États-Unis d’Amérique. Le secrétaire d’Etat américain, Antony Blinken a réitéré cette position à l’issue de son audience avec le président rwandais Paul Kagame ce jeudi 11 août 2022 à Kigali « J’ai discuté avec Paul Kagame de rapports crédibles selon lesquels le Rwanda continue à soutenir le groupe rebelle M23 en RDC » a déclaré à la presse ce diplomate américain. Ce rapport ayant fuité dans la presse accuse le Rwanda de soutenir la rébellion du M23 en guerre, depuis plusieurs mois, contre les FARDC dans le territoire de Rutshuru (Nord-Kivu). La rédaction",2022,"The report of UN experts on the support of Rwanda per M23 continues to worry the United States of America.The US Secretary of State, Antony Blinken reiterated this position after his audience with Rwandan President Paul Kagame this Thursday, August 11, 2022 in Kigali ""I discussed with Paul Kagame credible reports according to which Rwanda continues toSupporting the M23 rebellious group in the DRC, ""this American diplomat told the press.This report having leaked in the press accuses Rwanda of supporting the rebellion of the M23 in war, for several months, against the FARDC in the territory of Rutshuru (North Kivu).Writing"
https://rtnc.cd/soutien-du-rwanda-au-m23-la-rdc-vient-de-saisir-antonio-guterres-pour-solliciter-lexamen-et-la-publication-du-rapport-des-experts-de-lonu-vpm-lutundula/,"La République Démocratique du Congo vient de déposer officiellement sa correspondance auprès du Secrétaire général de l’Organisation des Nations-Unies (ONU), António Guterres, au sujet du rapport de ses experts qui confirme que le Rwanda a soutenu le M23 pour déstabiliser l’Est du pays. Cette annonce est faite ce mardi 9 août 2022, à Kinshasa par le Vice-premier ministre, ministre des Affaires étrangères, Christophe Lutundula, au cours de la conférence de presse animée conjointement avec Anthony Blinken, à l’occasion de sa visite en RDC. «Nous avons écrit au secrétaire général. La lettre est partie hier (…) Sous l’autorité du chef de l’État, le Gouvernement a mis le cap sur l’examen de ce rapport et sa mise à contribution par tous les intervenants bilatéraux et multilatéraux, afin de lever le voile et certaines zones d’ombres qui ont été créées délibérément et trouver une solution durable. En fait, le rapport c’est le diagnostic qui doit nous permettre de trouver le médicament qu’il faut », a annoncé Christophe Lutundula. Il sied de rappeler qu’un groupe d’experts des Nations-Unies a déclaré qu’il disposait des preuves solides que les troupes rwandaises ont mené des opérations militaires dans l’est de la République démocratique du Congo entre novembre 2021 et juillet de l’année 2022 en cours. Dans un rapport confidentiel consulté par Reuters jeudi dernier, ces mêmes experts ont ajouté que le Rwanda a soutenu l’avancée du groupe rebelle M23 en République démocratique du Congo, précisément dans la province du Nord-Kivu.",2022,"The Democratic Republic of Congo has just officially deposited its correspondence to the Secretary General of the United Nations Organization (UN), António Guterres, about the report of its experts who confirms that Rwanda supported the M23 to destabilize theIs from the country.This announcement is made this Tuesday, August 9, 2022, in Kinshasa by the Deputy Prime Minister, Minister of Foreign Affairs, Christophe Lutundula, during the press conference animated jointly with Anthony Blinken, on the occasion of his visit to the DRC.“We wrote to the Secretary General.The letter left yesterday (…) under the authority of the Head of State, the Government set for the examination of this report and its use by all the bilateral and multilateral stakeholders, in order to lift the veilAnd certain shadows that have been deliberately created and find a lasting solution.In fact, the report is the diagnosis that should allow us to find the medication that is necessary, ""said Christophe Lutundula.It is said to recall that a group of United Nations experts said that he had solid evidence that Rwandan troops have carried out military operations in the eastern Democratic Republic of Congo between November 2021 and July'Year 2022 in progress.In a confidential report consulted by Reuters last Thursday, these same experts added that Rwanda supported the advance of the Rebel M23 group in the Democratic Republic of Congo, precisely in the province of North Kivu."
https://rtnc.cd/nord-kivu-les-forces-speciales-des-fardc-formees-sur-la-lutte-contre-les-groupes-armes/,"Le Lieutenant Général Fall Sikabwe a présidé, ce Jeudi 17 octobre 2024, la cérémonie de clôture de la formation des forces spéciales des FARDC . Initiée par la mission SAMIDRC de la Communauté de Développement de l’Afrique Australe, (SADEC),cette formation entre dans le cadre des efforts conjoints pour renforcer les capacités des FARDC. Dans un communiqué parvenu à la rédaction de RTNC.CD, le secrétariat de la SADEC a aussi montré que cette formation vise à assurer une interopérabilité optimale entre les forces armées congolaises et celles de la SADC. « Les FARDC reçoivent plusieurs sortes des spécialités dispensées par notre équipe des formateurs, afin d’améliorer leur efficacité et d’assurer une coordination meilleure avec les éléments de la SADEC pendant les opérations d’ensemble », peut-on lire. Et d’ajouter : « Conformément à son mandat, la mission SAMIDRC a intensifié les efforts pour former les FARDC à maintenir et restaurer la paix à l’Est de la RDC « . Dans son mot, le Lieutenant Général Fall Sikabwe a loué la collaboration entre les FARDC et la SAMIDRC qui permet d’améliorer la performance sur terrain et de donner une réponse aux provocations des groupes armés. la SAMIDRC a été déployée à l’est du territoire congolais afin de renforcer les opérations des FARDC dans la traque des rebelles du M23 . Les forces loyalistes formées ont, tout au début de cette cérémonie, fait la démonstration des tactiques nouvellement acquises, une façon de rassurer leur hiérarchie ainsi que d’autres invités présents à cette manifestation .Advertisement. Scroll to continue reading.",2024,"Lieutenant General Fall Sikabwe chaired, this Thursday, October 17, 2024, the closing ceremony for the FARDC special forces formation.Initiated by the Samidrc mission of the development community of southern Africa (SADEC), this training is part of joint efforts to strengthen the capacities of FARDC.In a press release in the drafting of RTNC.CD, the SADEC secretariat also showed that this training aims to ensure optimal interoperability between the Congolese armed forces and those of SADC.""The FARDC receives several kinds of the specialties provided by our team of trainers, in order to improve their efficiency and to ensure better coordination with the elements of the SADEC during the overall operations,"" we can read.And to add: ""In accordance with its mandate, the Samidrc mission has intensified efforts to train the FARDC to maintain and restore peace in the east of the DRC"".In his word, Lieutenant General Fall Sikabwe praised the collaboration between FARDC and Samidrc which improves performance on land and to give an answer to provocations of armed groups.Samidrc was deployed in the east of the Congolese territory in order to strengthen the operations of the FARDC in the hunt for the rebels of the M23.The formed loyalist forces have, at the start of this ceremony, demonstrated newly acquired tactics, a way of reassuring their hierarchy as well as other guests present to this. Advertisement.Scroll to continue reading."
