Source,Articles,Year,Translated Articles
https://rtnc.cd/guerre-dans-lest-de-la-rdc-il-y-a-des-preuves-qui-attestent-que-cest-le-rwanda-qui-soutient-le-m23-jaynet-kabila/,"La députée nationale, Jaynet Désirée Kabila Kyungu, sœur jumelle de l’ancien président de la République démocratique du Congo, Joseph Kabila Kabange, accuse la République du Rwanda de soutenir les groupes armés qui menacent la sécurité de la République Démocratique du Congo et la sous-région. Analysant la situation sécuritaire en Afrique du Sud où elle participe aux travaux interparlementaires, l’élue de Kalemie, chef-lieu de la province de Tanganyika, s’est dite étonnée de voir le même M23 rebondir militairement, alors qu’il a été totalement défait en 2013. « En 2013, les M23 dont nous parlons aujourd’hui a été défait par l’armée congolaise, les forces armées de la République démocratique du Congo. Et toutes ces années, ils ont même écrit. Ils ont signé un communiqué pour dire qu’il n’y aura plus de guerre et vont participer dans les efforts de paix et politiques dans leur pays. Mais chose étonnante, aujourd’hui nous parlons du M23 qui n’existait plus il y a 8 ans. Et nous avons des rapports des Nations unies. Il y a des preuves que c’est notre voisin le Rwanda qui soutient les rebellions, cette rébellion du M23 », a-t-elle déclarée. Jaynet Kabila pense que le problème congolais, au-delà de la présence des autres groupes armés actifs sur son territoire, reste le soutien rwandais au M23. «Oui nous avons 120 groupes armés mais ce n’est pas ça le problème. Le plus grand problème c’est le M23 qui est soutenu par le Rwanda. Nous sommes condamnés à vivre ensemble, mais nous soutenons les efforts de la paix. J’ai une proposition : vu que les FDLR sont des rwandais, le Rwanda devrait faire un effort pour dialoguer avec eux parce que ce sont des rwandais, même s’ils sont sur notre territoire », préconise la députée sœur de Kabila. Depuis le début de cette énième agression du Rwanda contre la RDC, la plus part d’interventions des opérateurs politiques congolais, si pas toutes abondent dans le même sens. Ils tiennent à condamner le Rwanda et à appeler le peuple congolais à la vigilance et à la mobilisation générale. La Rédaction Pages : 1 2",2022,"The national deputy, Jaynet Désirée Kabila Kyungu, twin sister of the former president of the Democratic Republic of Congo, Joseph Kabila Kabange, accuses the Republic of Rwanda of supporting armed groups which threaten the security of the Democratic Republic of Congo and the Sub-region.Analyzing the security situation in South Africa where she participates in the inter-parliamentary work, the elected representative of Kalemie, capital of the province of Tanganyika, said it was surprised to see the same M23 rebound militarily, while he was completelyDefeated in 2013. “In 2013, the M23s we are talking about today was defeated by the Congolese army, the Armed Forces of the Democratic Republic of Congo.And all these years, they even wrote.They signed a press release to say that there will be no more war and will participate in peace and political efforts in their country.But surprisingly, today we are talking about the M23 which no longer existed 8 years ago.And we have reports of the United Nations.There is evidence that it is our neighbor Rwanda that supports the rebellions, this M23 rebellion, ""she said.Jaynet Kabila thinks that the Congolese problem, beyond the presence of other armed groups active in its territory, remains Rwandan support per m23.""Yes, we have 120 armed groups but that's not the problem.The biggest problem is the M23 which is supported by Rwanda.We are condemned to live together, but we support the efforts of peace.I have a proposal: since the FDLR are Rwandans, Rwanda should make an effort to dialogue with them because they are Rwandans, even if they are on our territory, ""advocates Kabila's sister deputy.Since the start of this umpteenth attack in Rwanda against the DRC, most of the interventions of Congolese political operators, if not all abound in the same direction.They want to condemn Rwanda and call the Congolese people to vigilance and general mobilization.Writing Pages: 1 2"
https://rtnc.cd/affaire-m23-500-jeunes-recrutes-par-kigali-pour-agresser-la-rdc-alerte-lopposante-rwandaise-justine-habimana/,"Dans un message publié mercredi, 9 novembre 2022 dans la soirée, à travers le réseau social tweeter, consulté par RTNC.CD, l’opposante rwandaise, Justine Habimana dénonce le récrutement par Kigali de 500 jeunes pour renforcer les troupes rwandaises qui agressent la République Démocratique du Congo. « Près de 500 jeunes, sans motivation, sont capturés pour agresser la RDC » a t-elle dénoncé depuis son compte tweeter. Hibimana indique également que la psychose de peur régne côté population rwandaise depuis que les forces armées de la République démocratique du Congo ont passé à la vitesse supérieure avec des frappes aériennes. La rédaction",2022,"In a message published Wednesday, November 9, 2022 in the evening, through the social network Tweeter, consulted by RTNC.CD, the Rwandan opponent, Justine Habimana denounces the recruitment by Kigali of 500 young people to strengthen the Rwandan troops which attack the RepublicDemocratic of Congo.""Nearly 500 young people, without motivation, are captured to attack the DRC,"" she denounced from her tweeter account.Hibimana also indicates that psychosis of fear reigns on the Rwandan population side since the Armed Forces of the Democratic Republic of Congo went up a gear with air strikes.Writing"
https://rtnc.cd/guerre-dans-lest-de-la-rdc-leac-appelle-a-la-reprise-du-dialogue-et-la-reintegration-du-m23-a-ce-processus/,"Après des consultations avec le Président en exercice de l’EAC Evariste Ndayishimiye du Burundi le vendredi, 4 novembre2022 , le facilitateur Uhuru Kenyatta s’est engagé à accélérer le processus de paix en RDC, renseigne une dépêche de la présidence de l’EAC consultée par RTNC.CD. La prochaine session de dialogue entre les parties au conflit en RDC est fixée au 15 novembre 2022 , selon la source. Evariste Ndayishimiye s’est réjouit que les Chefs d’Etat de la Communauté Est Africaine sont tous unanimes pour le rétablissement de la paix en RDC et les appelle à maintenir la paix chacun dans son pays afin de bloquer le passage aux groupes armés qui voudraient perturber la paix et la sécurité dans la région. Etant donné que les groupes armés qui créent la terreur et la désolation en RDC disent qu’ils combattent pour les intérêts de leurs communautés, le Président en exercice de l’EAC exhorte les leaders coutumiers à s’impliquer dans le dialogue afin d’apporter leur contribution au rétablissement de la paix en RDC. Il a, en outre, exprimé sa gratitude aux pays membres de l’EAC qui ont déjà répondu à la sollicitation d’envoyer les militaires en mission de paix en RDC en se réjouissant que le peuple de la communauté éprouve une grande confiance en ces troupes. « Nous remercions le Président du Kenya, Son Excellence William Ruto qui vient dernièrement d’envoyer les militaires », a laissé entendre le Président du Sommet des Chefs d’Etat avant d’annoncer qu’il va rehausser de sa présence la session prochaine de dialogue entre les parties prenantes au conflit en RDC qui se tiendra au Kenya. Prenant la parole, le Facilitateur Uhuru Kenyatta a salué les efforts du Président Burundais à restaurer la paix à l’Est de la RDC et a remercié le Burundi pour avoir été le premier pays à envoyer les troupes en mission de paix en RDC. « Nous apprécions le travail abattu par les forces Burundais à l’Est de la RDC, mais malheureusement un autre conflit vient récemment d’éclater au Nord-Kivu. Nous demandons au Kenya et à l’Ouganda de déployer les forces à leur tour en vue de soutenir le Burundi » a indiqué l’Ancien Président Kenyan qui a tenu à saluer le combat du Président Ndayishimiye et du peuple Burundais pour rétablir la paix dans leur pays en laissant de côté leurs différences. Il a ainsi invité le peuple Congolais à suivre cet exemple. De son côté, le Facilitateur Kenyatta a réaffirmé son engagement à accélérer le processus de médiation quitte à atteindre un consensus entre les parties prenantes au conflit afin d’asseoir la paix et la stabilité en RDC. Vous saurez que cette rencontre survient au lendemain du message à la Nation délivré Par le président de la République Démocratique du Congo à travers lequel il a lancé un appel général au peuple congolais à unir leurs forces pour rétablir la paix et la sécurité dans leur pays.Advertisement. Scroll to continue reading.",2022,"After consultations with the ECA EAC EAC ECAYISHIMIYE DU BURUNDI president on Friday, November 4, 2012, the Uhuru Kenyatta facilitator has undertaken to accelerate the peace process in the DRC, informs a dispatch from the presidency of the EAC consultedby RTNC.CD.The next session of dialogue between the parties to the conflict in the DRC is set for November 15, 2022, according to the source.Evariste Ndayishimiye is delighted that the heads of state of the community is African are all unanimous in the restoration of peace in the DRC and calls them to maintain peace each in their country in order to block the passage to armed groups which would like to disruptPeace and security in the region.Since the armed groups which create terror and desolation in the DRC say that they are fighting for the interests of their communities, the president in office of the EAC urges the customary leaders to get involved in the dialogue in order to bringtheir contribution to the restoration of peace in the DRC.He also expressed his gratitude to the member countries of the EAC which have already responded to the request to send the military on a peace mission to the DRC by rejoicing that the people of the community experience great confidence in these troops.""We thank the president of Kenya, His Excellency William Ruto who has recently sent the soldiers,"" suggested the president of the Summit of Heads of State before announcing that he will enhance his presence the upcoming session ofDialogue between stakeholders in the conflict in the DRC which will be held in Kenya.Speaking, Uhuru Kenyatta facilitator praised the Burundian president's efforts to restore peace to the east of the DRC and thanked Burundi for having been the first country to send the troops on a peace mission to the DRC.""We appreciate the work shot dead by Burundian forces east of the DRC, but unfortunately another conflict has just broke out in North Kivu.We ask Kenya and Uganda to deploy the forces in turn in order to support Burundi ""said former President Kenyan who wanted to salute the fight of President Ndayishimiye and the Burundian people to restore peace in theircountries leaving aside their differences.He thus invited the Congolese people to follow this example.For his part, the Kenyatta facilitator reaffirmed his commitment to accelerating the mediation process even if it means reaching a consensus between stakeholders in the conflict in order to establish peace and stability in the DRC.You will know that this meeting occurs the day after the message to the nation issued by the President of the Democratic Republic of the Congo through which he launched a general appeal to the Congolese people to unite their forces to restore peace and security in their country.Advertisement.Scroll to continue reading."
https://rtnc.cd/soutien-du-rwanda-au-m23-le-gouvernement-de-la-rdc-salue-la-position-des-usa-contre-kigali/,"Le gouvernement de la République Démocratique du Congo a, par truchement de son porte-parole, le ministre de la Communication et Médias, Patrick Muyaya Katembwe, salué la position clairement exprimée par les États-Unis d’Amérique au conseil de sécurité des Nations unies. Le pays de Joe Baden a appelé le Rwanda à cesser de soutenir la rébellion du M23. Dans un message publié sur son compte twitter, jeudi 27 octobre 2022, Patrick Muyaya pense que d’autres pays devraient suivre ce pas, afin de mettre fin à cette entreprise belliqueuse de Kigali. «Nous saluons la position claire du gouvernement américain contre le soutien que le Rwanda apporte au M23. Les autres pays devraient emboîter le pas et œuvrer pour mettre fin à cette barbarie qui cause la mort et le déplacement massif de nos populations », dit le ministre de la communication et médias Il sied de rappeler que dans son intervention lors de la réunion du Conseil de sécurité de l’ONU sur la région des Grands Lacs, Robert Wood, Représentant alternatif pour les Affaires politiques spéciales au sein de la Mission des États-Unis auprès des Nations unies, a vivement dénoncé le soutien du Rwanda dans la résurgence du M23. «Ces violences sont inacceptables, et les États-Unis exigent des groupes armés qu’ils mettent fin à leurs attaques contre les populations les plus vulnérables de la RDC. Nous appelons également les acteurs étatiques à cesser de soutenir ces groupes, notamment l’aide apportée par les Forces de défense rwandaises au M23 » a t-il déclaré Pour rappel, lors de son récent séjour à Londres, le président Félix-Antoine Tshisekedi Tshilombo avait interpellé la communauté internationale face à cette situation sécuritaire dans l’Est du pays créée par Paul Kagame et son gouvernement pour déstabiliser pays ; avant de marteler que l’option militaire n’est pas écartée, en cas d’échec d’une solution diplomatique.Advertisement. Scroll to continue reading. La rédaction",2022,"The Government of the Democratic Republic of Congo has, through its spokesperson, the Minister of Communication and Media, Patrick Muyaya Katembwe, hailed the position clearly expressed by the United States of America in the United Nations Security Council.Joe Baden's country called on Rwanda to stop supporting the M23 rebellion.In a message published on his Twitter account, Thursday October 27, 2022, Patrick Muyaya thinks that other countries should follow this step, in order to end this bellicose company in Kigali.“We salute the clear position of the United States government against the support that Rwanda gives to the M23.The other countries should follow the plunge and work to put an end to this barbarism which causes the death and massive movement of our populations, ""says the Minister of Communication and Media he began to recall that in his intervention during the meeting of the CouncilUN security in the Great Lakes region, Robert Wood, an alternative representative for special political affairs within the United States mission to the United Nations, strongly denounced the support of Rwanda in the resurgence of the M23.""These violence is unacceptable, and the United States demands armed groups that they put an end to its attacks on the most vulnerable populations of the DRC.We also call on state actors to stop supporting these groups, including the aid provided by the Rwandan defense forces in the M23, ""he said as a reminder, during his recent stay in London, President Félix-Antoine Tshisekedi Tshilombohad arrested the international community in the face of this security situation in the east of the country created by Paul Kagame and his government to destabilize the country;Before hammering that the military option is not excluded, in the event of a diplomatic solution. Advertisement.Scroll to continue reading.Writing"
https://rtnc.cd/combats-fardc-terroristes-rwandais-m23-larmee-loyaliste-appelle-les-journalistes-au-sens-de-responsabilite/,"Les Forces Armées de la République Démocratique du Congo (FARDC) appellent les professionnels des médias au sens de responsabilité dans le traitement et la publication des informations « allant dans le sens de décourager l’armée loyaliste » pendant cette période où le pays fait face à l’agression rwandaise. A travers un communiqué transmis aux responsables des médias du Nord-Kivu mercredi 26 octobre 2022, le général major Sylvain Ekenge « met en garde toute personne qui diffusera des nouvelles injustes et fakenews dans un seul but de nuire la République » Pour conclure, il rappelle qu’en cette période de crise sécuritaire, « le rôle des médias est d’accompagner les militaires FARDC dans la lutte contre l’agression rebelle». La rédaction",2022,"The Armed Forces of the Democratic Republic of Congo (FARDC) call media professionals in the sense of responsibility in the processing and publication of information ""going in the sense of discouraging the loyalist army"" during this period when the country faces itRwandan assault.Through a press release sent to media officials in North Kivu on Wednesday, October 26, 2022, General Sylvain Ekenge ""warns anyone who will disseminate unjust news and fakenews for a single purpose of harming the Republic"" to conclude, he recallsthat in this period of security crisis, ""the role of the media is to accompany the FARDC soldiers in the fight against rebellious aggression"".Writing"
https://rtnc.cd/combats-a-rutshuru-entre-les-fardc-et-les-terroristes-rwandais-m23-larmee-reguliere-rassure-que-la-situation-est-sous-controle-sur-tous-les-fronts-communique/,"Quelques localités du territoire de Rutshuru qui ont été attaquées depuis le jeudi 20 octobre 2022 par les terroristes rwandais (M23) sont « sous contrôle des Forces armées de la RDC et de la Police nationale congolaise », rapporte le porte parole des FARDC via un communiqué parvenu ce dimanche à RTNC.CD . A en croire le général de brigade Sylvain Ekenge, les Forces armées sont déterminées à « répondre avec vigueur à ces attaques, de défendre l’intégrité du territoire et de protéger la population jusqu’au sacrifice suprême » (Ci-dessous le communiqué)",2022,"Some localities in the Ratshuru territory which have been attacked since Thursday, October 20, 2022 by Rwandan terrorists (M23) are ""under the control of the armed forces of the DRC and the Congolese national police,"" reports the FARDC spokesperson via a press releaseHaving reached this Sunday at RTNC.CD.According to Brigadier General Sylvain Ekenge, the armed forces are determined to ""respond with vigor these attacks, to defend the integrity of the territory and to protect the population to the supreme sacrifice"" (below the press release)"
https://rtnc.cd/rdc-le-general-yav-est-accuse-davoir-complote-avec-le-rwanda-pour-faciliter-la-prise-de-goma-par-le-m23-felix-tshisekedi/,"Se confiant le vendredi à RFI et France 24 depuis New York, le président Tshisekedi est revenu sur l’arrestation et la détention du général Philémon Yav à la prison centrale de Makala. A en croire le chef de l’État congolais, les soupçons de complot contre la République pèsent sur le commandant de la 3e zone de défense. Selon la même source , le lieutenant-général est accusé d’avoir des connivences avec le Rwanda pour faciliter la prise de Goma, chef-lieu du Nord-Kivu, par les M23. «J’ai cru comprendre qu’il était accusé par certains de ses collègues de les avoir contactés au nom du Rwanda pour qu’ils puissent lever le pied et permettre au M23 de passer aisément et de prendre la ville de Goma. Mais, les enquêteurs sont à pied d’œuvre pour le moment », a déclenché Félix Tshisekedi à RFI et France 24. Toutes fois , le président de la République a annoncé que les enquêtes sont encore en cours. La rédaction",2022,"Confident on Friday to RFI and France 24 from New York, President Tshisekedi returned to the arrest and detention of General Philémon Yav in Makala central prison.According to the Congolese head of state, suspicions of conspiracy against the Republic weigh on the commander of the 3rd defense zone.According to the same source, the lieutenant-general is accused of having collusion with Rwanda to facilitate the taking of Goma, capital of North Kivu, by the M23.""I understand that he was accused by some of his colleagues of having contacted them in the name of Rwanda so that they can lift their foots and allow the M23 to pass easily and take the city of Goma.But, the investigators are hard at work at the moment, ""said Félix Tshisekedi in RFI and France 24. Early, the President of the Republic has announced that the surveys are still underway.Writing"
