Source,Articles,Year,Translated Articles
https://rtnc.cd/patrick-muyaya-le-m23-ne-participe-pas-aux-discussions-de-nairobi-tant-quil-na-pas-evacue-les-localites-occupees-conformement-a-ce-qui-a-ete-decide-a-luanda/,"L’appel patriotique du Président de la République, Félix-Antoine Tshisekedi Tshilombo, aux 200 délégués des groupes armés réunis à Nairobi pour le 3ème round des négociations politiques, a été vulgarisé, lundi, au cours du briefing hebdomadaire du gouvernement co-animé par la vice-Première ministre, ministre de l’Environnement et développement durable, Eve Bazaiba et Patrck Muyaya, ministre de la Communication et médias. «Souvenez-vous de combien des tables rondes, des conférences nationales organisées, combien d’accords signés… il est temps pour chacun de nous de s’engager pour le développement de notre pays qu’aucun individu ne peut faire seul », a dit le Chef de l’Etat Selon le porte parole du gouvernement Patrick Muyaya , aucun délégué du M23 ne doit prendre part à ces assises tant que les résolutions de Luanda ne sont pas respectées. «Qu’aujourd’hui s’est ouvert le début des discussions avec les groupes armés à Nairobi sous l’égide du président Ndayishimiye du Burundi, suivant le programme tracé au terme du communiqué de Luanda. Pour nous, le M23 ne participe pas aux discussions de Nairobi tant qu’il n’a pas évacué les localités occupées conformément à ce qui a été décidé à Luanda» a dit le ministre de la communication et médias. Et de noter : «Depuis la signature de l’accord de Luanda, on note une relative accalmie sur toute la ligne de front malgré quelques mouvements dans la partie occupée par le M23, nous continuons de suivre la situation » Par la même occasion, Patrick Muyaya a, au nom de l’exécutif national, salué les efforts diplomatiques déployés par le Président de la République en vue de restaurer la paix et la sécurité dans l’Est du pays. La rédaction",2022,"The Patriotic Call of the President of the Republic, Félix-Antoine Tshisekedi Tshilombo, to the 200 delegates of armed groups gathered in Nairobi for the 3rd round of political negotiations, was popularized on Monday, during the weekly briefing of the government co-animated byThe Deputy Prime Minister, Minister of the Environment and Sustainable Development, Eve Bazaiba and Patrck Muyaya, Minister of Communication and Media.""Remember how many round tables, organized national conferences, how many signed agreements ... It is time for each of us to commit to the development of our country that no individual can do alone,"" saidThe head of state according to the spokesperson for government Patrick Muyaya, no M23 delegate must take part in these meetings as long as Luanda resolutions are not respected.""That today was the start of discussions with armed groups in Nairobi under the aegis of President Ndayishimiye du Burundi, following the program drawn after the Luanda press release.For us, the M23 does not participate in Nairobi's discussions as long as it has not evacuated the localities occupied in accordance with what was decided in Luanda, ""said the Minister of Communication and Media.And to note: ""Since the signing of the Luanda agreement, there has been a relative lull on the entire front line despite some movements in the part occupied by the M23, we continue to follow the situation"" at the same time, PatrickMuyaya, on behalf of the national executive, welcomed the diplomatic efforts made by the President of the Republic with a view to restoring peace and security in the east of the country.Writing"
https://rtnc.cd/agression-rwandaise-le-mini-sommet-de-luanda-exige-la-cessation-de-tout-soutien-politico-militaire-au-m23/,"Le mini-sommet sur la paix et la sécurité dans la région Est de la République Démocratique du Congo, réunissant 3 chefs d’Etats de la CAE sous la conduite du Président Angolais Joâo Lourenço a débouché sur un accord de cessez-le-feu imposé au groupe terroriste M23, à dater du vendredi 25 novembre à 18 H. L’accord exige aussi que le M23 se retire des zones occupées en RDC à dater du 27 novembre. L’accord signé par les 5 participants au mini-sommet dont 3 chefs d’État en exercice comprend un calendrier précis de mesures contraignantes pour rétablir la paix et la sécurité à l’Est de la RDC avec notamment le désarmement et le cantonnement des éléments du M23 sous le contrôle des FARDC, de la Force régionale de la CAE, du mécanisme de vérification ad hoc et de la MONUSCO. Le communiqué final du mini sommet de Luanda précise ainsi : « L’intervention de la Force Régionale contre le M23 , conformément aux prescrits du Processus de Nairobi et au rapport de la réunion des Chefs d’Etat -majors de la CAE , qui s’est tenue à Bujumbura, le 8 novembre 2022 , en cas de refus du M23 de cesser les hostilités et de se retirer des territoires occupés « . Ce mini sommet a aussi exigé la cessation de tout soutien politico-militaire au M23 et à tous les autres groupes armés locaux et étrangers opérant à l’EST de la RDC et dans la région. Enfin, le communiqué final stipule la poursuite d’une coordination permanente à tous les niveaux entre le Processus de Luanda et le processus de Nairobi. Les Chefs d’Etat ont convenu de se retrouver prochainement à Bujumbura pour l’évaluation de l’application des conclusions des résolutions et recommandations du mini sommet de Luanda. La rédaction",2022,"The Mini-Sommet on Peace and Security in the eastern region of the Democratic Republic of Congo, bringing together 3 CAE heads of state under the leadership of the Angolan president Joâo Lourenço led to a cease-fire agreement imposedTo the M23 terrorist group, to date from Friday, November 25 at 6 p.m. the agreement also requires that the M23 withdraws from the areas occupied in the DRC to date from November 27.The agreement signed by the 5 participants in the mini-summit, including 3 heads of state in practice includes a specific calendar of binding measures to restore peace and security in the east of the DRC with in particular the disarmament and the cantonment of the elementsof the M23 under the control of the FARDC, the regional force of the CAE, the ad hoc verification mechanism and the Monusco.The final press release of the mini summit of Luanda specifies thus: ""The intervention of the regional force against the M23, in accordance with the prescribes of the Nairobi process and the report of the meeting of the heads of state -majors of the CAE, which isis held in Bujumbura, on November 8, 2022, in the event of refusal of the M23 to stop hostilities and to withdraw from the occupied territories "".This mini summit also demanded the cessation of any politico-military support in the M23 and all other local and foreign armed groups operating east of the DRC and in the region.Finally, the final press release stipulates the continuation of permanent coordination at all levels between the Luanda process and the Nairobi process.Heads of state agreed to meet in Bujumbura soon to assess the application of conclusions of resolutions and recommendations from the mini Summit of Luanda.Writing"
https://rtnc.cd/mini-sommet-de-luanda-le-m23-somme-de-quitter-les-positions-occupees-au-nord-kivu-faute-de-quoi-la-force-militaire-regionale-va-simposer-communique-final/,"Il s’est tenu ce mercredi 23 novembre 2022 un mini sommet, à Luanda en Angola , sur la paix en RDC, rapporte une dépêche de la presse présidentielle parvenue à RTNC.CD. Cette rencontre « de haut niveau » a réuni les présidents Félix Antoine Tshisekedi Tshilombode la RDC, Evariste Ndayishimiye du Burundi, le Facilitateur Uhuru Kenyatta qui ont fait le déplacement sous l’invitation du président Angolais João Lourenço. Le Président du Rwanda Paul Kagame pourtant annoncé , s’est fait représenter par son ministre des Affaires Étrangères Vincent Biruta. Chaque Chef de délégation était accompagné de 5 membres à cette réunion à huis clos. A l’issue de cette rencontre un communiqué final a été signé par toute les parties , dans lequel plusieurs résolutions ont été arrêtées : a) La Cessation des hostilités en général, et en particulier des attaques du M23 contre les FARDC et la MONUSCO à partir du vendredi 25 novembre 2022 à 18h00 (Jour J) ; b) le respect total des exigences des communiqués des conclaves des chefs d’État de l’EAC du 21 avril et du 20 juin 2022 (processus de Nairobi), de la feuille de route de Luanda du 6 juillet 2022 (processus de Luanda) et des conclusions de l’Assemblée extraordinaire Réunion des chefs d’état-major général des forces armées de l’EAC (Bujumbura, 8 novembre 2022) ; c) La poursuite du déploiement complet de la Force régionale de l’EAC ; d) le retrait du M23 des zones occupées et retour à ses positions initiales à Sabinio côté RDC, sous le contrôle des FARDC, de la Force Régionale et du Mécanisme Ad Hoc en collaboration avec la MONUSCO (J+2) ; e) la création d’une zone tampon avec l’appui de la MONUSCO, du Mécanisme de vérification ad hoc et de la Force régionale de l’EAC, comme prévu dans le cadre de la réunion des chefs d’état-major général de l’EAC tenue à Bujumbura, le 8 novembre 2022 (jour J +2); f) La cessation de tout soutien politico-militaire au M23 et à tous les autres groupes armés locaux et étrangers opérant dans l’Est de la RDC et la Région (Jour J) ; g) Les FDLR-FOCA, RED-TAMARA, ADF et les autres groupes armés opérant sur le territoire congolais doivent immédiatement déposer les armes et entamer leur rapatriement inconditionnel conformément aux termes du Processus de Nairobi, avec le soutien de la MONUSCO, du Mécanisme ad hoc de vérification et du Force Régionale EAC (Jour J+5) ;Advertisement. Scroll to continue reading. h) Le désarmement et cantonnement du M23 en territoire congolais sous contrôle des FARDC, de la Force Régionale et du Mécanisme Ad Hoc de Vérification, avec la collaboration de la MONUSCO (Jour J+5) ; i) Le retour des Personnes Déplacées Internes (PDI) dans leurs foyers (J+7) ; j) la reprise et poursuite des consultations politiques entre le Gouvernement de la RDC et les groupes armés locaux (J+10) ; k) La reprise du dialogue bilatéral entre la RDC et le Rwanda en vue de la normalisation des relations diplomatiques et de la reprise de la coopération (J+60) ; l) l’engagement des parties à la mise en œuvre de la feuille de route de Luanda et des accords conclus lors du processus de Nairobi et de la réunion des chefs d’état-major de la CAE ; m) l’ examen et résolution de la question du retour de tous les réfugiés dans leur pays d’origine, telle qu’évoquée dans la Feuille de route de Luanda et (J+15) ; n)la poursuite des réunions de coordination à tous les niveaux entre le Processus de Luanda et le Processus de Nairobi ; o) la création du Mécanisme conjoint de suivi et d’évaluation de la mise en œuvre de la Feuille de route de Luanda et des décisions des initiatives entreprises dans le cadre du Processus de Nairobi. p. Les chefs d’État ont demandé que les FARDC, la Force régionale et les chefs d’état-major général (CGS) de la Force régionale EAC, en collaboration avec la MONUSCO, étudient toutes les questions liées au désarmement et au cantonnement des éléments du M23 et leur soumettent des propositions à leur prochain mini-sommet;Advertisement. Scroll to continue reading. Q. Les Chefs d’Etat ont recommandé l’accélération de la mise en œuvre du Programme de Désarmement, Démobilisation, Réinsertion Communautaire et Stabilisation (PDDR-CS) en cours en RDC et ont exprimé leur profonde préoccupation quant aux conditions dans lesquelles vivent des centaines de milliers de déplacés en RDC. zones touchées par la guerre dans la province du Nord-Kivu. R. Les Chefs d’Etat sont convenus de se retrouver prochainement à Bujumbura pour évaluer la mise en œuvre des conclusions des résolutions et recommandations du Mini-Sommet de Luanda; t. Enfin, les chefs d’État ont remercié Son Excellence João Manuel Gonçalves Lourenço , Président de la République d’Angola, Champion de l’Union africaine pour la paix et la réconciliation en Afrique et Médiateur désigné par l’Assemblée de l’Union africaine, pour l’accueil fraternel et l’hospitalité qu’il a réservé à eux ainsi que son implication active dans la résolution de la crise sécuritaire dans la région de l’Est de la RDC.",2022,"This Wednesday, November 23, 2022 was held a mini summit, in Luanda in Angola, on peace in the DRC, reports a dispatch from the presidential press reached at RTNC.CD.This ""high -level"" meeting brought together the presidents Félix Antoine Tshisekedi Tshilombode The DRC, Evariste Ndayishimiye du Burundi, the facilitator Uhuru Kenyatta who made the trip under the invitation of the Angolan president João Lourenço.The president of Rwanda Paul Kagame, however, announced, was represented by his Minister of Foreign Affairs Vincent Biruta.Each chief delegation was accompanied by 5 members at this meeting at home.At the end of this meeting a final press release was signed by all the parties, in which several resolutions were arrested: a) the cessation of hostilities in general, and in particular attacks of the M23 against the FARDC and the Monusco fromFrom Friday November 25, 2022 to 6:00 p.m. (D -Day);b) Total respect for the requirements of the press releases of the EAC heads of state of April 21 and June 2022 (Nairobi process), the Luanda roadmap of July 6, 2022 (Luanda process)and conclusions of the extraordinary meeting of the chiefs of general staff of the EAC armed forces (Bujumbura, November 8, 2022);c) the continuation of the complete deployment of the regional force of the EAC;d) the withdrawal of the M23 of the occupied areas and return to its initial positions to Sabinio on the RDC side, under the control of the FARDC, the regional force and the ad hoc mechanism in collaboration with the Monusco (J+2);e) the creation of a buffer zone with the support of Monusco, ad hoc verification mechanism and the regional force of the EAC, as planned as part of the meeting of general staff ofEAC held in Bujumbura, November 8, 2022 (day D +2);f) the cessation of any politico-military support per m23 and all other local and foreign armed groups operating in the east of the DRC and the region (D-Day);g) FDLR-FOCA, Red-Tamara, ADF and other armed groups operating on Congolese territory must immediately lay down their arms and start their unconditional repatriation in accordance with the terms of the Nairobi process, with the support of Monusco, of the Ad mechanismHOC of verification and regional force EAC (Day D+5); Advertisement.Scroll to continue reading.h) the disarmament and cantonment of the M23 in Congolese territory under the control of the FARDC, the regional force and the ad hoc verification mechanism, with the collaboration of the Monusco (Day D+5);i) The return of internal displaced people (PDI) to their homes (J+7);j) the recovery and continuation of political consultations between the DRC government and local armed groups (J+10);K) the resumption of bilateral dialogue between the DRC and Rwanda for the normalization of diplomatic relations and the resumption of cooperation (J+60);l) the commitment of the parties to the implementation of the Luanda roadmap and the agreements concluded during the Nairobi process and the meeting of the CAE staff;m) the examination and resolution of the question of the return of all refugees in their country of origin, as mentioned in the Luanda roadmap and (J+15);n) The continuation of coordination meetings at all levels between the Luanda process and the Nairobi process;o) The creation of the joint monitoring and evaluation mechanism of the implementation of the Luanda roadmap and the decisions of the initiatives undertaken as part of the Nairobi process.p.The heads of state asked that the FARDC, the regional force and the general staff (CGS) of the EAC regional force, in collaboration with the Monusco, study all the questions related to the disarmament and the cantonment of the elementsfrom the M23 and submit proposals to their next mini-summark; advertisement.Scroll to continue reading.Q. Heads of State recommended the acceleration of the implementation of the disarmament program, demobilization, community reintegration and stabilization (PDDR-CS) in progress in the DRC and expressed their deep concern about the conditions in which livehundreds of thousands of displaced in the DRC.Areas affected by war in the province of North Kivu.A. The heads of state have agreed to meet soon in Bujumbura to assess the implementation of the conclusions of the resolutions and recommendations of the Luanda mini-summit;t.Finally, the heads of state thanked His Excellency João Manuel Gonçalves Lourenço, President of the Republic of Angola, champion of the African Union for Peace and Reconciliation in Africa and Mediator appointed by the Assembly of the African Union, for the fraternal reception and the hospitality he has reserved for them as well as his active involvement in the resolution of the security crisis in the Eastern region of the DRC."
https://rtnc.cd/soutien-du-rwanda-au-m23-felix-tshisekedi-en-tete-a-tete-ce-lundi-avec-son-homologue-kenyan-ruto/,"Le Président du Kenya William Ruto est arrivé dimanche à Kinshasa, la capitale congolaise, pour rencontrer son homologue congolais Félix-Antoine Tshisekedi Tshilombo ce lundi 21 novembre 2022 , en vue de trouver une sortie de crise entre la RDC et le Rwanda. Il s’agit d’une rencontre dite aussi de la coopération bilatérale », précise les services de communication de la Présidence congolaise. Il sied de rappeler que La RDC et Rwanda ont été à nouveau plongés dans une crise depuis plus d’un mois. l’État congolais accuse son voisin, le Rwanda, de soutenir l’activisme du M23 à la partie Est du pays. Une dénonciation qui est approuvée par les experts de l’ONU et plusieurs acteurs internationaux et nationaux . La rédaction",2022,"Kenya president William Ruto arrived in Kinshasa on Sunday, the Congolese capital, to meet his Congolese counterpart Félix-Antoine Tshisekedi Tshilombo this Monday, November 21, 2022, in order to find a crisis outing between the DRC and Rwanda.This is also a meeting called bilateral cooperation, ""said the communication services of the Congolese presidency.It is said to remember that the DRC and Rwanda have been plunged into a crisis again for more than a month.The Congolese state accuses its neighbor, Rwanda, of supporting activism from M23 to the eastern part of the country.A denunciation which is approved by UN experts and several international and national actors.Writing"
https://rtnc.cd/agression-rwandaise-kagame-se-dit-pret-a-exhorter-le-m23-pour-un-retrait-immediat-des-territoires-conquis-en-rdc-communique-eac/,"L’ancien président kényan, facilitateur désigné de la Communauté d’Afrique de l’Est dans le processus de Nairobi pour la paix et la sécurité à l’est de la République démocratique du Congo, reste déterminé à trouver une solution à la crise qui sévit entre Kinshasa et Kigali à la suite de l’incursion des militaires rwandais sur le sol congolais. Uhuru Kenyatta a parlé au secrétaire général des Nations-Unies ainsi qu’à certains chefs d’Etat sous-régionaux dont Félix Tshisekedi de la RDC, Evariste Ndayishimiye du Burundi et Paul Kagame du Rwanda. Avec le président rwandais, le facilitateur a évoqué les conditions humanitaires déplorables que traversent des populations du Nord-Kivu suite aux affrontements entre l’armée congolaise et le M23. A travers un communiqué rendu public ce vendredi 18 novembre 2022 dont une copie est consultée par RTNC.CD, la Communauté d’Afrique de l’Est indique que les 2 personnalités ont reconnu la nécessité pour les forces de l’EAC de sécuriser les zones contrôlées par le M23 afin d’y assurer la sécurité et la stabilité. A l’occasion, Paul Kagame a accepté d’aider Uhuru Kenyatta à obtenir le cessez-le-feu et le retrait du M23 des positions conquises. « Le facilitateur de l’EAC a informé le président Kagame de son voyage à Goma et de la situation époustouflante dont il a été témoin dans le camp des déplacés internes. Ils sont d’accord sur la nécessité de mettre en oeuvre et d’adopter les recommandations des chefs de défense de l’EAC et en particulier la nécessité pour la force régionale de prendre immédiatement en charge et de sécuriser les zones récemment capturées par le M23 et assurer la paix, la stabilité et la sécurité des civils dans la région. Le président Kenyatta en discussion avec le président Kagame, a convenu de la nécessité d’un cessez-le-feu immédiat et le président Kagame a également accepté d’aider le facilitateur à exhorter le M23 à cesser le feu et à se retirer des territoires capturés », rapporte ce document Il sied de rappeler que le dimanche dernier, Uhuru Kenyatta a séjourné en République démocratique du Congo en prélude de nouveaux pourparlers entre le gouvernement congolais et les groupes armés. A Kinshasa et à Goma, le facilitateur sous-régional a rencontré des acteurs politiques et sociaux autour de cette question. Au Nord-Kivu où il a séjourné le mardi 15 novembre dernier, Kenyatta a visité le camp des déplacés de Kanyarucinya où il a déploré la situation humanitaire causée par les affrontements, appelant ainsi à un cessez-le-feu. La rédaction",2022,"Former Kenyan President, designated facilitator of the Eastern African Community in the Nairobi process for peace and security in the east of the Democratic Republic of Congo, remains determined to find a solution to the crisis thatrang between Kinshasa and Kigali following the foray for Rwandan soldiers on Congolese soil.Uhuru Kenyatta spoke to the Secretary General of the United Nations as well as to certain sub-regional heads of state including Félix Tshisekedi of the DRC, Evariste Ndayishimiye du Burundi and Paul Kagame from Rwanda.With the Rwandan President, the facilitator spoke of the deplorable humanitarian conditions that the populations of North Kivu are going through following the clashes between the Congolese army and the M23.Through a press release made public this Friday, November 18, 2022, a copy of which is consulted by RTNC.CD, the Eastern African Community indicates that the 2 personalities have recognized the need for the EAC forces to secure the zonescontrolled by the M23 to ensure safety and stability.On the occasion, Paul Kagame agreed to help Uhuru Kenyatta to obtain the ceasefire and the withdrawal of the M23 of the conquered positions.""The facilitator of the EAC informed President Kagame of his trip to Goma and the breathtaking situation he witnessed in the camp of the internal displaced.They agree on the need to implement and adopt the recommendations of EAC defense leaders and in particular the need for the regional force to take charge of immediately and to secure the areas recently captured by the M23And ensure peace, stability and security of civilians in the region.President Kenyatta in discussion with President Kagame, agreed with the need for an immediate ceasefire and President Kagame also agreed to help the facilitator to exhort the M23 to stop fire and to withdraw from the territoriesCaptured, ""reports this document, it is said to recall that last Sunday, Uhuru Kenyatta stayed in the Democratic Republic of Congo as a prelude to new talks between the Congolese government and armed groups.In Kinshasa and Goma, the sub-regional facilitator has met political and social actors around this issue.In North Kivu where he stayed on Tuesday, November 15, Kenyatta visited the camp of the displaced Kanyarucinya where he deplored the humanitarian situation caused by clashes, thus calling for a cease-fire.Writing"
